pdf_id,page,akk_block_id,akk_text,akk_bbox,akk_column,trans_block_id,trans_text,trans_lang,trans_bbox,trans_column,score,distance_px,same_column,has_marker,reading_order_ok
Larsen 1977a_Iraq39_partnerships,9,p9_c3_b3,"135
54 (14) 2.TA Su-uq-lá-tim (15) ku-nu-ki 5a A-limk1
(16) 23 MA.NA.TA AN.NA (17) 29 TúG.TA ku-ta-ni
(18) ù 2.TA ANE.HI.A (19) qá-tám ni-il5-qé (20) 2‡ TúG
1 ANE (21) i-li-bi, Im-di-DINGIR (22§MA.NA LA 1
GÍN (23) KUG.BABBAR Sa-al-Sa-tim (24) ni-lá-qé (25)
1 MA.NA i-na me-5i-it (26) e-lá-tim! Sa-lim-A-Sùr
Im-di-DINGIR (27) i Pu-Su-ki-in i-ld-qe-ú.","1567,136,2269,2555",3,p9_c2_b2,"PARTNERSHIPS IN THE OLD ASSYRIAN TRADE
least state the possibilities : (1) it could go to the investors, (2) it could go to the
tractator, or (3) it could be divided among the parties. The second solution seems
distinctly improbable, and in my view the first possibility is the more likely one. In
the cases where the tractator had invested in his own naruggum he would of course share
in this amount as well.
A major problem is then whether these accounting procedures, which are postu-
lated in the explanation given above, can be found in our textual material from
Kane. We do have a number of references to the computation of altum, but it is
impossible to decide in practically all cases whether these refer to long-term naruqqu-
contracts or to partnerships of other types. I have already mentioned the fact that
we have a number of different transactions of this nature, various investments and
short-term partnerships, and it seems clear that at least part of the terminology was
common to all such procedures. Many of these transactions were certainly arranged
along the same basic lines as the narugqu-contract.52 It should also be remembered
that our one contract only represents one of perhaps several ways in which the details
of a narugqu-transaction could be organized. Thus, it remains a possibility that other
naruqqu-contracts gave the investors the right to share in the profits which were
currently realized in the individual transactions.
Let me present a few examples of texts which are concerned with the computation
and payment of altum. The document ICK 1:I24, which I cannot claim to under-
stand in all details, begins with the statement that goods bought for 49 minas 47
shekels of silver "" between us "", i.e. held in partnership, have arrived at Kane; it is
also stated that the entire capital invested in the partnership was one talent of silver,
so c. Io minas remain uninvested in Assur. From the account which follows we can
see that after the payment of the nishtum-tax to the Anatolian palace and after the
preemption by the same authority, 89 pieces of textiles remained. For the tin the
transporter had paid the nishtum-tax, and the extra expenses incurred en route had
been paid; what remained amounted to 6 unopened uqlum-containers (of each 65
minas) plus 69 minas from various opened containers.53 The text continues :
We have taken (our) shares each 2 uqlum-containers under the seal of the City,
(plus) 23 minas of tin, 29 textiles, and two donkeys.
Imdi-ilum has (the remaining) 2‡ textiles and one donkey. We shall receive
48 shekels of silver, the altum. Salim-Aur, Imdi-ilum and Puu-ken will
receive I  mina from the "" fund of the companies "".54
The three men mentioned at the end were obviously partners who shared the joint
capital of one talent of silver, a very considerable investment. The fact that only part
of this amount has been invested in this transaction makes it likely that the partner-
ship was supposed to continue and encompass further overland transactions. Are
s2 See for instance the text published by Oppen-
heim, op. cit., where a certain Enna-Suen is given
I mina of silver with which he is to "" conduct trade
on two journeys.""
53 For the complex procedures involving the pay-
ment of taxes and the pre-emption of up to 1o per
cent of the textiles I refer to OACP, 156-161.",en,"1143,141,2011,2562",2,0.46330178165590924,553.0653216393159,False,False,True
