pdf_id,page,akk_block_id,akk_text,akk_bbox,akk_column,trans_block_id,trans_text,trans_lang,trans_bbox,trans_column,score,distance_px,same_column,has_marker,reading_order_ok
"Grayson, A. Kirk - Assyrian Rulers of the Third and Second Millennia BC (to 1115 BC). RIMA 1, 1987",190,p190_c0_b0,"Exs. 1-3 were found in the courtyard of the Asšur tem- ple; the remaining exs. were found in various parts of the city or their provenance is unknown.
The brick inscription translated in Haller, Heilig- tümer p. 47 n. 93 (cf. Grayson, ARI 1 LXXVI 36) has
1922 Schroeder, KAH 2 no. 39 (exs. 2-3, copy) 1922 BM Guide p. 65 (ex. 5, study) 1924 Maynard, JSOR 8 p. 5 (exs. 2-3, translation) 1926 Weidner, IAK xx 27 (exs. 1-4, edition) 1926 Luckenbill, ARAB 1 §107 no. 1 (exs. 2-3, translation)
1) m10-ÉRIN.TÁH ŠID aš-šur 2) A GÍD-DI-DINGIR ŠID CtŠ-ŠUr-mQ 3) mu-ta-li-ik-ta 4) šá ki-sa-al a-ba-ri šá É 5) aš-šur EN-SW ik-si-ir","35.7599983215332,346.9682922363281,258.65229415893555,803.6060485839844",0,p190_c1_b1,"167 Adad-nārārī i A.0.76.12
35
This text appears on several bricks from the courtyard of the Aššur temple at Aššur.
C A T A L O G U E
Museum Ass Ass ph Ex. number number number cpn
1 ES 6631 5326 622 c 2 E§ 9220 17877b 5492, 5639 c 3 ES 9219 17877a - c 4 VA Ass 3228c 21728 6716 c 5 BM 90739 (1979-12-20,331) - _ c 6 VA Ass 3228b 18368a c 7 ES 9340 23077 _ c 8 E§ 9218 + 9323 _ _ c 9 ES 9216 _ _ c 10 VA Ass 3228a 3461a - c
C O M M E N T A R Y
B I B L I O G R A P H Y
T E X T
36
This text is on a brick from Aššur.",en,"101.63999938964844,32.884490966796875,456.2379608154297,1336.6679992675781",1,0.6259077663892912,171.40132333749693,False,False,True
